Job Title,Seniority Level,Company,Company Type,Experience Required,Location,Job Description
UI/UX Designer,Senior,Cognizant,Service,5-8 years,Seattle,"Senior UX Designer and Design Systems Lead. Required: Figma, deep expertise in atomic design, and experience building and maintaining large-scale design systems. Must lead design critiques, conduct strategic user research, and influence product direction. Experience with accessibility audits, design tokens, and Storybook integration preferred."
Machine Learning Engineer,Senior,Tech Mahindra,Service,5-8 years,Chennai,"Senior ML Engineer for real-time personalization systems. Required: PyTorch, Spark, Flink, experience with online learning and bandit algorithms. Must design low-latency inference systems, manage feature stores, and work with large-scale A/B testing frameworks. Experience with recommendation systems for e-commerce or media platforms preferred."
Machine Learning Engineer,Mid,TCS,Service,2-5 years,Bangalore,"Deliver NLP automation projects for BPO and insurance clients. Required: Python, spaCy or NLTK, and REST API development. Experience with text classification, named entity recognition, and deploying models on Azure ML or AWS SageMaker."
UI/UX Designer,Mid,Wipro,Service,0-2 years,Chennai,"UX Designer for enterprise application redesign. Required: Figma, wireframing, user research, and stakeholder presentation skills. Experience designing enterprise B2B applications, following client brand guidelines, and conducting usability testing. Must deliver both low-fidelity wireframes and high-fidelity prototypes within tight deadlines."
Cybersecurity Engineer,Mid,Lyft,Product,5-8 years,Chennai,"Cloud Security Engineer. Required: AWS/Azure security services, Terraform, and experience with CSPM tools (Prisma Cloud, Wiz). Must implement zero-trust network architecture, manage secrets (HashiCorp Vault), and automate compliance checks. CISSP or CEH certification preferred. Experience with SOC2 and ISO 27001 audits."
DevOps Engineer,Mid,Amazon,Product,2-5 years,Bangalore,"Build and maintain developer platforms and CI/CD pipelines. Skills: GitHub Actions or Jenkins, Docker, Helm, and ArgoCD. Experience with GitOps, infrastructure as code, and developer experience improvements. Familiarity with secrets management (Vault) and security scanning in pipelines."
Frontend Developer,Mid,Infosys,Service,2-5 years,Bangalore,"Build enterprise intranet and HR portals for large clients. Required: React or Angular, Bootstrap or Material UI, and REST APIs. Familiarity with SharePoint or SAP Fiori is a bonus. Good documentation and client communication skills expected."
Software Engineer,Staff,Lyft,Product,8+ years,Hyderabad,"Staff Software Engineer to define technical direction across multiple teams. Required: 8+ years building large-scale systems, deep expertise in distributed computing, and strong leadership skills. Must be able to write technical proposals, evaluate architectural tradeoffs, and influence engineering culture. Experience with org-wide platform initiatives and mentoring senior engineers."
AI Engineer,Mid,Cognizant,Service,2-5 years,Bangalore,"Implement AI chatbot and automation solutions for enterprise clients using Azure OpenAI and LangChain. Must have Python skills, REST API development experience, and knowledge of prompt engineering. Ability to gather requirements, manage client expectations, and deliver PoCs quickly."
UI/UX Designer,Mid,LTIMindtree,Service,2-5 years,Bangalore,"Create UI designs and wireframes for client-facing web and mobile applications. Required: Figma or Adobe XD, strong visual design skills, and experience following client brand guidelines. Ability to present designs to clients, incorporate feedback, and hand off specs to development teams."
Backend Developer,Mid,Dropbox,Product,2-5 years,Seattle,"Backend Developer for real-time systems using WebSockets and event streaming. Required: Node.js or Python, Kafka or NATS, Redis pub/sub, and experience building low-latency APIs. Must design systems for real-time notifications, live data feeds, or collaborative features. Strong understanding of concurrency and connection management."
Data Engineer,Mid,Databricks,Product,2-5 years,Hyderabad,"Data Engineer proficient in Python and PySpark. Build and maintain ETL pipelines ingesting terabytes of data daily. Required: Python, Apache Spark, Airflow, dbt, and experience with data lakes (S3 + Delta Lake or Iceberg). Must handle schema evolution, data quality checks, and work with both batch and streaming data (Kafka or Kinesis)."
Software Engineer,Entry,SAP,Product,0-2 years,Bangalore,"Junior Software Developer for our product engineering team. Responsibilities include developing and testing new features in Python/Node.js, debugging production issues, writing unit tests, and participating in code reviews. Strong academic background in CS or equivalent. Familiarity with React for frontend tasks is a bonus. Eager to learn and grow in a fast-paced startup environment."
Software Engineer,Mid,Mindtree,Service,8+ years,Chennai,"Go Engineer for high-performance infrastructure services. Required: Go, gRPC, Protobuf, PostgreSQL, and Redis. Experience building concurrent, high-throughput services, writing benchmarks, and profiling Go applications. Familiarity with etcd, Consul, or Kubernetes operators is a plus. Must write clean, idiomatic Go code with comprehensive testing."
Frontend Developer,Mid,Uber,Product,2-5 years,Bangalore,"Build performant, accessible consumer web experiences used by hundreds of millions of users. Required: React, TypeScript, GraphQL, and deep CSS expertise. Experience with performance optimization (Core Web Vitals), component libraries, and design systems. Familiarity with Next.js, Webpack, and browser rendering internals preferred."
DevOps Engineer,Mid,Coinbase,Product,2-5 years,Delhi NCR,"Platform Engineer to build internal developer platforms. Required: Kubernetes, Helm, ArgoCD, GitHub Actions, and Python. Experience with GitOps workflows, secrets management (HashiCorp Vault), and developer portal tooling (Backstage). Must collaborate with engineering teams to improve deployment velocity and developer experience."
Software Engineer,Mid,JP Morgan,Product,8+ years,Bangalore,"Python is the primary language for this role. Must have deep expertise in Python 3.x, async programming (asyncio, aiohttp), type hints, and modern Python packaging. Experience with FastAPI or Django REST Framework, SQLAlchemy, Celery for background tasks, and pytest for testing. Must follow clean code principles, write well-documented APIs, and participate in architecture design."
Cloud Engineer,Mid,Tech Mahindra,Service,2-5 years,Bangalore,"Support cloud migration and managed services for enterprise clients. Required: Azure or AWS certifications, Terraform, and PowerShell or Bash scripting. Experience with lift-and-shift migrations, disaster recovery, and 24/7 support SLAs."
Mobile Developer,Mid,OpenAI,Product,2-5 years,Hyderabad,"iOS Engineer. Required: Swift, SwiftUI, UIKit, and experience publishing apps to the App Store. Must implement MVVM or TCA architecture patterns, integrate REST APIs, and optimize app performance. Experience with Core Data, Push Notifications, and App Store Connect. Familiarity with Swift Concurrency (async/await) required."
Machine Learning Engineer,Mid,Zoom,Product,2-5 years,New York,"ML Engineer to build production machine learning systems. Required: Python, PyTorch or TensorFlow, experience with feature engineering, model training, and deployment using Flask or FastAPI. Familiarity with MLflow or Weights & Biases for experiment tracking, and Docker for containerization. Must understand model evaluation metrics and be comfortable working with data scientists."
Software Engineer,Entry,Goldman Sachs,Product,0-2 years,Bangalore,"Entry-level Software Engineer to join our team. Required: Strong CS fundamentals, proficiency in Python or Java, knowledge of data structures and algorithms, and experience with Git. Exposure to web frameworks like Django or Spring Boot is a plus. You will work on building new features, fixing bugs, and learning from senior engineers. LeetCode problem-solving skills expected. Good communication and ability to work in Agile teams required."
Cloud Engineer,Entry,Mindtree,Service,0-2 years,Bangalore,"Junior Cloud Engineer to support cloud infrastructure operations. Required: Basic AWS or Azure knowledge, Linux administration, and scripting in Bash or Python. Exposure to Docker and Terraform. Willingness to learn Kubernetes, infrastructure-as-code, and cloud security best practices. AWS Cloud Practitioner certification is a plus."
Backend Developer,Mid,Amazon,Product,2-5 years,Bangalore,"Develop payment and transaction processing systems. Skills: Java or Kotlin, Spring Boot, SQL, and experience with financial data integrity and idempotency. Knowledge of PCI DSS compliance, distributed transactions, and high-throughput system design."
Software Engineer,Mid,Capgemini,Service,2-5 years,Delhi NCR,"Senior Software Engineer for digital transformation project. Required: Python or Java, microservices, Kafka, Docker, Kubernetes, and Azure. Experience leading a small team, reviewing code, and communicating technical decisions to non-technical stakeholders. PMP or Agile certification is a bonus."
Software Engineer,Mid,LinkedIn,Product,2-5 years,Bangalore,"Design and develop large-scale distributed systems handling millions of requests per day. Strong proficiency in Python, Java, or Go required. Deep understanding of data structures, algorithms, and system design. Experience with microservices architecture, REST and gRPC APIs, Kubernetes, and cloud platforms (AWS/GCP/Azure). Must have strong CS fundamentals, experience with code reviews, and ability to work in fast-paced agile teams. LeetCode-style problem solving ability expected."
DevOps Engineer,Mid,Google,Product,2-5 years,Bangalore,"Own cloud cost optimization and capacity planning for large-scale services. Required: AWS (EKS, RDS, S3, Lambda), Terraform, and Python. Experience with auto-scaling, spot instances, and FinOps practices. Strong cross-team collaboration to drive reliability and efficiency."
Full Stack Developer,Mid,Lyft,Product,5-8 years,Bangalore,"Full Stack TypeScript Developer (Node.js + React). Required: TypeScript, Next.js, Node.js, PostgreSQL, and Prisma. Experience with tRPC or GraphQL, Zod for schema validation, and Turborepo for monorepo management. Must be comfortable with both frontend and backend development and deploy on Vercel or AWS."
Systems Engineer,Mid,KPIT Technologies,Service,2-5 years,San Francisco,"Rust Engineer for WebAssembly and edge computing. Required: Rust, WASM, and experience deploying to edge runtimes (Cloudflare Workers, Fastly Compute). Must optimize binary size and startup time, work with WASI interfaces, and build portable, sandboxed applications."
System Architect,Mid,Microsoft,Product,2-5 years,Bangalore,"Architect AI/ML infrastructure and data platforms. Skills: Deep understanding of data architecture (lakehouse, Lambda/Kappa), ML platforms, and real-time processing (Flink/Spark Streaming). Experience with architectural governance, cloud cost optimization, and leading cross-functional technical planning."
Data Analyst,Mid,Accenture,Service,2-5 years,Bangalore,"Deliver data analytics and reporting solutions for retail and logistics clients. Skills: SQL, Python, Excel, and Power BI or Tableau. Experience with ETL pipelines, data cleaning, and business reporting. Ability to gather client requirements and deliver dashboards on tight timelines."
Data Engineer,Mid,Capgemini,Service,2-5 years,Delhi NCR,"Analytics Engineer (dbt specialist). Required: dbt (Core or Cloud), SQL, Snowflake or BigQuery, and Python. Must design modular, well-documented dbt models, implement data testing, and manage the semantic layer. Experience with data observability tools (Monte Carlo, Elementary) and working closely with analysts."
Software Engineer,Senior,Reddit,Product,5-8 years,New York,"Senior Engineer for our platform team owning developer productivity tooling. Required: Python and Bash scripting, Kubernetes, CI/CD (GitHub Actions), and monorepo management. Experience building internal developer platforms, reducing deployment friction, and driving engineering efficiency. Must collaborate with infrastructure and product teams."
DevOps Engineer,Mid,Amazon,Product,2-5 years,Delhi NCR,"DevOps Engineer to manage and scale cloud infrastructure. Required: AWS or GCP, Kubernetes, Terraform, and strong scripting skills in Python and Bash. Experience setting up CI/CD pipelines, monitoring (Prometheus + Grafana), and log management (ELK stack). Must ensure high availability, implement disaster recovery, and enforce security best practices."
Machine Learning Engineer,Entry,Lyft,Product,0-2 years,Remote,"Junior ML Engineer to help build and maintain machine learning pipelines. Required: Python, scikit-learn, pandas, numpy, and SQL. Exposure to TensorFlow or PyTorch through projects or coursework. Ability to process large datasets, run experiments, and evaluate model performance. Strong mathematical foundation in statistics and linear algebra. Kaggle competition experience is a plus."
AI Researcher,Mid,Tech Mahindra,Service,2-5 years,Bangalore,"Apply ML research techniques to solve practical business problems for clients in finance and healthcare. Skills: Python, PyTorch or TensorFlow, and experience translating research papers into production solutions. Ability to write technical reports and present to clients. Master's degree in ML or related field preferred."
Data Scientist,Mid,L&T Infotech,Service,2-5 years,Chennai,"Data Scientist building demand forecasting and inventory optimization models. Required: Python, time-series modeling (Prophet, ARIMA, LSTM), SQL, and experience working with supply chain or retail data. Ability to translate business requirements into modeling problems and present results to operations teams."
Backend Developer,Senior,Apple,Product,5-8 years,Pune,"Senior Backend Engineer for high-scale transaction systems. Required: Go or Java, deep expertise in concurrent programming, database optimization, and distributed systems design. Must lead backend architecture decisions, drive performance improvements, and mentor engineers. Experience with event sourcing, CQRS, and multi-region deployments."
UI/UX Designer,Mid,Airbnb,Product,2-5 years,Pune,"Product Designer for mobile and web applications. Required: Figma, experience designing end-to-end product flows, conducting user research, and creating high-fidelity prototypes. Must contribute to and maintain a design system, work closely with PMs and engineers, and use data to validate design decisions. Motion design skills are a plus."
Machine Learning Engineer,Mid,Infosys,Service,2-5 years,Hyderabad,"AI/ML Engineer for banking automation project. Required: Python, scikit-learn, TensorFlow, and REST API development. Experience building document classification and OCR-based extraction solutions. Must deploy models on Azure ML or AWS SageMaker and maintain model performance over time. Good communication for client walkthroughs."
Blockchain Developer,Mid,Robinhood,Product,0-2 years,Mumbai,"Solidity Smart Contract Developer. Required: Solidity, Hardhat or Foundry, ethers.js or web3.js, and experience deploying on EVM-compatible chains. Must write gas-optimized, secure smart contracts, conduct security audits, and integrate with DeFi protocols. Experience with ERC standards (ERC-20, ERC-721, ERC-1155) and OpenZeppelin libraries."
AI Researcher,Mid,Apple,Product,2-5 years,Bangalore,"Push the frontier of multimodal learning and generative AI. Skills: PyTorch, diffusion models, vision-language models, and experience with large-scale training runs. Must thrive in a research environment, propose and execute experiments independently, and communicate findings clearly."
Data Analyst,Mid,L&T Infotech,Service,2-5 years,Remote,"Business Intelligence Analyst. Required: SQL, Power BI or Tableau (advanced), and experience with data warehousing concepts. Must build enterprise-grade dashboards, manage data models, and collaborate with data engineering on ETL pipelines. Strong business acumen and ability to translate data into actionable insights."
QA Engineer,Mid,Robinhood,Product,5-8 years,Pune,"Software Development Engineer in Test (SDET). Required: Python or Java, Selenium or Playwright for UI automation, and REST API testing (Postman, RestAssured). Experience with CI/CD integration, performance testing (JMeter or k6), and test reporting frameworks. Must define test strategies, write reusable test frameworks, and champion quality culture."
Software Engineer,Mid,TCS,Service,2-5 years,Pune,"Software Developer for telecom client engagement. Required: Python or Java, REST APIs, MySQL, and Linux. Experience in Agile delivery, sprint planning, and documentation. Must be comfortable working in large enterprise codebases, handling change requests, and following ITIL processes. TCS BaNCS or iON product knowledge is an added advantage."
Data Analyst,Mid,Google,Product,2-5 years,Bangalore,"Support business intelligence and reporting for marketing and growth teams. Skills: SQL, Excel, Tableau or Power BI, and basic Python (pandas). Experience with campaign attribution, customer segmentation, and KPI tracking. Comfortable working with large datasets and presenting findings to senior leadership."
AI Researcher,Senior,NIIT Technologies,Service,5-8 years,Pune,"Senior Research Scientist in Reinforcement Learning. Required: PhD in CS or related field, publications at top venues (NeurIPS, ICML, ICLR), and deep expertise in RL algorithms (PPO, SAC, DreamerV3). Must independently drive research agendas and collaborate with product teams. Experience with large-scale RL training infrastructure preferred."
Data Analyst,Mid,Uber,Product,2-5 years,Bangalore,"Build and maintain analytical models for financial reporting. Required: Advanced SQL, dbt, and Python. Experience with data modeling, dimensional schemas, and working closely with data engineers. Familiarity with Monte Carlo or Great Expectations for data quality."
Database Engineer,Mid,Cognizant,Service,2-5 years,Bangalore,"Design and implement database solutions for ERP and CRM implementations. Skills: MySQL or PostgreSQL, stored procedures, indexing, and ETL (SSIS or Informatica). Experience working with SAP or Salesforce data models is a strong plus."
Software Engineer,Mid,Accenture,Service,8+ years,Hyderabad,"Backend Java Engineer for enterprise financial systems. Required: Java 17+, Spring Boot, Hibernate, Apache Kafka, and PostgreSQL. Must design RESTful microservices, implement event-driven patterns, and ensure high transaction throughput. Experience with JVM performance tuning, Spring Security, and containerization with Docker and Kubernetes."
Cybersecurity Engineer,Mid,Mastech Digital,Service,0-2 years,New York,"Application Security Engineer. Required: SAST/DAST tools (Checkmarx, Burp Suite), Python, and experience with secure SDLC practices. Must conduct code reviews for security vulnerabilities, perform penetration testing on web APIs, and train developers on OWASP Top 10. Bug bounty program experience is valued."
AI Engineer,Mid,Twitter/X,Product,2-5 years,Hyderabad,"AI Engineer to design and deploy LLM-based applications. Required: Python, LangChain or LlamaIndex, experience with vector databases (FAISS, Pinecone, Weaviate), and RAG pipeline design. Must understand embedding models, chunking strategies, and retrieval evaluation. Experience fine-tuning smaller LLMs (Mistral, Llama) is a strong plus."
DevOps Engineer,Mid,Wipro,Service,2-5 years,Bangalore,"DevOps Engineer for cloud migration engagement. Required: Jenkins, Docker, Kubernetes, Terraform, and Azure or AWS. Experience migrating on-premise applications to cloud, setting up CI/CD pipelines, and monitoring with ELK stack. ITIL process knowledge and client communication skills required."
DevOps Engineer,Senior,IBM,Service,5-8 years,Hyderabad,"Senior DevOps/SRE Engineer to own reliability and scalability of production systems. Required: Kubernetes (advanced), Terraform, service mesh (Istio), and observability (Datadog or Honeycomb). Experience with chaos engineering, incident response, and SLO/SLA management. Must lead infrastructure design discussions and drive culture of reliability."
DevOps Engineer,Mid,Coinbase,Product,0-2 years,Chennai,"Site Reliability Engineer for e-commerce platform. Required: Kubernetes, Terraform, AWS, Prometheus, Grafana, PagerDuty, and Python. Must define and enforce SLOs, conduct blameless post-mortems, automate toil, and improve system observability. Experience with chaos engineering (Chaos Monkey, Litmus) and capacity planning."
AI Researcher,Mid,Infosys,Service,2-5 years,Mumbai,"Research Engineer in AI Safety and Alignment. Required: Strong ML background, experience with LLM training, and familiarity with alignment research (RLHF, Constitutional AI, interpretability). Must implement research experiments, run evaluations, and contribute to safety-focused papers. Ability to bridge research and engineering teams."
Backend Developer,Mid,Apple,Product,2-5 years,Bangalore,"Build robust, scalable APIs and backend services powering consumer products. Required: Python (FastAPI/Django) or Go, PostgreSQL, Redis, and REST/GraphQL API design. Experience with authentication (OAuth2, JWT), rate limiting, and writing clean, well-tested code. Familiarity with Kafka or RabbitMQ for async processing."
Data Scientist,Mid,JP Morgan,Product,2-5 years,Bangalore,"Build predictive models for fraud detection and risk scoring. Skills: Python, XGBoost, LightGBM, and deep learning. Experience with imbalanced datasets, model calibration, and regulatory explainability (SHAP, LIME). Familiarity with real-time scoring pipelines and feature engineering at scale."
DevOps Engineer,Mid,Infosys,Service,5-8 years,Delhi NCR,"Cloud Infrastructure Engineer. Required: AWS (EC2, S3, RDS, Lambda), Terraform, Ansible, and Linux. Experience with infrastructure automation, patch management, and 24/7 NOC support. Must document runbooks, handle incidents, and collaborate with development teams on deployment processes. AWS Associate certification preferred."
AI Engineer,Mid,Google,Product,2-5 years,Bangalore,"Develop and fine-tune large language models for core AI features. Required: Python, PyTorch, Hugging Face, and experience with RLHF or instruction tuning. Familiarity with distributed training (DeepSpeed, FSDP), inference optimization, and GPU resource management. Strong ML fundamentals essential."
Data Analyst,Mid,Wipro,Service,2-5 years,Mumbai,"MIS Analyst for banking operations. Required: Advanced Excel, SQL, and basic Python. Experience automating daily/weekly MIS reports, reconciliation, and data validation. Must work with large datasets, identify discrepancies, and escalate issues to project managers. Knowledge of VBA macros is a plus."
DevOps Engineer,Mid,Accenture,Service,2-5 years,Bangalore,"Manage IT infrastructure and deployments for banking and government clients. Required: Linux administration, shell scripting, Ansible, and VMware. Experience with ITIL processes, change management, and DR/BCP planning. RHCE or AWS certification preferred."
Data Scientist,Senior,DeepMind,Product,5-8 years,Hyderabad,"Senior Data Scientist for growth and monetization analytics. Required: Advanced Python and SQL, deep expertise in experimentation design, and experience with large-scale behavioral data. Must lead end-to-end analytical projects, mentor junior data scientists, and influence product roadmaps with data. Expertise in Bayesian methods, survival analysis, or NLP is a strong plus."
UI/UX Designer,Mid,Stripe,Product,2-5 years,Bangalore,"Lead end-to-end design for mobile and web products. Skills: Figma, Principle or ProtoPie, and experience with WCAG accessibility standards. Must be able to run design sprints, conduct A/B tests, and iterate based on quantitative and qualitative data. Motion design experience is a plus."
DevOps Engineer,Mid,LTIMindtree,Service,2-5 years,Bangalore,"Support DevOps transformation projects for enterprise clients. Skills: Jenkins, Docker, Kubernetes, and Azure DevOps. Experience migrating on-premise workloads to cloud and setting up monitoring with ELK stack or Datadog. Client-facing communication and documentation skills required."
Database Engineer,Mid,TCS,Service,2-5 years,Bangalore,"Database Engineer for transactional systems. Required: PostgreSQL or MySQL (expert level), query optimization, indexing, and schema design. Experience with replication, connection pooling (PgBouncer), and migration tooling (Flyway, Liquibase). Familiarity with Redis for caching layers and monitoring with pg_stat_statements."
Software Engineer,Senior,Apple,Product,5-8 years,Hyderabad,"Senior Software Engineer to lead development of distributed systems serving millions of users. Required: Expert-level Python, Java or Go, deep knowledge of system design, and experience with high-availability architectures. Must mentor junior engineers, lead technical design discussions, and drive cross-team initiatives. Experience with Kubernetes, Terraform, and large-scale database optimization essential."
Cloud Engineer,Senior,Meta,Product,5-8 years,Chennai,"Senior Cloud Architect. Required: Multi-cloud expertise (AWS + GCP or Azure), advanced Terraform, and experience designing secure, scalable, and cost-efficient cloud architectures. Must lead cloud migration projects, define FinOps practices, and mentor junior cloud engineers. Experience with cloud networking (VPNs, Direct Connect, Transit Gateway) essential."
