Job Title,Seniority Level,Company,Company Type,Experience Required,Location,Job Description
System Architect,Mid,HCL Technologies,Service,2-5 years,Bangalore,"Lead solution architecture for digital transformation projects at enterprise clients. Required: TOGAF certification, experience with cloud migration (Azure/AWS), and strong client-facing skills. Ability to create architecture blueprints, manage stakeholder expectations, and oversee delivery teams."
Data Scientist,Mid,HCL Technologies,Service,2-5 years,Bangalore,"Support data analytics engagements for FMCG and retail clients. Required skills: Python, R, Excel, SQL, and Tableau. Experience with market basket analysis, sales forecasting, and KPI dashboards. Ability to manage client stakeholders and present insights in business language."
Data Analyst,Mid,Mphasis,Service,0-2 years,Hyderabad,"Financial Data Analyst. Required: SQL, Python, Excel (advanced), and experience with financial reporting, P&L analysis, and variance reporting. Must build automated financial models, work with ERP data (SAP or Oracle Financials), and present insights to CFO and finance leadership. CFA or CPA background is a plus."
AI Engineer,Mid,Hexaware,Service,2-5 years,Chennai,"AI Engineer focused on AI safety and evaluation. Required: Python, experience with LLM evaluation frameworks, red-teaming, and building test suites for AI outputs. Familiarity with Constitutional AI, RLHF, or alignment research is valued. Must design systematic evaluation pipelines and work with research teams."
Data Engineer,Mid,Airbnb,Product,8+ years,Seattle,"Senior Data Engineer to build real-time data pipelines. Required: Python, Kafka, Flink or Spark Streaming, and cloud data warehouses (Snowflake or BigQuery). Experience with data modeling, CDC (Change Data Capture), and building reusable pipeline frameworks. Must mentor junior engineers and define data engineering best practices."
AI Researcher,Mid,Goldman Sachs,Product,2-5 years,Bangalore,"Research and develop novel approaches to alignment, interpretability, and safe AI systems. Required: Strong ML background, experience with LLM training and evaluation, and interest in AI safety. Familiarity with RLHF, Constitutional AI, or mechanistic interpretability research a strong plus."
Frontend Developer,Mid,Amazon,Product,2-5 years,Bangalore,"Own the frontend architecture of a fast-growing SaaS product. Required: Vue.js or React, Tailwind CSS, REST and WebSocket APIs. Experience with micro-frontend architecture, monorepos (Nx/Turborepo), and CI/CD. Strong code review and mentoring skills."
AI Researcher,Mid,Mphasis,Service,2-5 years,Hyderabad,"Applied Research Scientist in NLP. Required: PhD or Master's in CS/ML, strong publication record, and hands-on expertise with transformer models, fine-tuning, and RLHF. Must conduct research, implement experiments in PyTorch, and collaborate with engineering teams to productionize findings. Experience with evaluation benchmarks like MMLU, HumanEval, or BIG-Bench preferred."
System Architect,Staff,Goldman Sachs,Product,8+ years,Seattle,"Security Architect to define and enforce security architecture across all systems. Required: Deep knowledge of zero-trust architecture, identity management (OAuth2, SAML), and cloud security best practices. Experience with security frameworks (NIST, CIS), threat modeling, and conducting security architecture reviews for new projects."
DevOps Engineer,Senior,Pinterest,Product,5-8 years,Remote,"Cloud Security Engineer (DevSecOps). Required: AWS security services (IAM, GuardDuty, Security Hub), Terraform, and experience integrating security scanning into CI/CD pipelines (Snyk, Trivy, Checkov). Must conduct threat modeling, manage compliance (SOC2, ISO 27001), and train engineering teams on secure coding practices."
Data Analyst,Mid,Intuit,Product,2-5 years,Delhi NCR,"Marketing Data Analyst. Required: SQL, Python, and experience with marketing analytics platforms (Google Analytics, Mixpanel, Amplitude). Must analyze campaign performance, build attribution models, and measure ROI across channels. Familiarity with CRM data (Salesforce) and cohort analysis is required."
Data Analyst,Mid,Infosys,Service,0-2 years,Delhi NCR,"Data Analyst for retail analytics client. Required: SQL, Python (pandas), Power BI, and Excel. Experience with sales reporting, inventory analysis, and KPI dashboards. Must handle data from multiple sources, clean and transform it, and present weekly reports to client management. Knowledge of SAP BW or BEx is a plus."
Machine Learning Engineer,Mid,SAP,Product,2-5 years,Delhi NCR,"ML Engineer specializing in NLP and recommendation systems. Required: Python, Hugging Face Transformers, experience fine-tuning BERT or GPT-style models. Familiarity with embedding models, vector databases (FAISS or Pinecone), and RAG pipelines. Must have strong software engineering skills to deploy models as scalable APIs."
Software Engineer,Mid,Accenture,Service,2-5 years,Pune,"Technology Analyst - Full Stack Developer. Required: React, Node.js or Java, MongoDB or PostgreSQL, and AWS basics. Experience in client delivery projects, Agile methodology, and writing clean, maintainable code. Must be comfortable with rapid prototyping, demos to clients, and shifting priorities."
Software Engineer,Mid,Google,Product,2-5 years,Bangalore,"Full-stack software engineering role focused on building consumer-facing features at scale. Proficiency in React, TypeScript, Node.js, and Python. Experience with GraphQL, A/B testing, and feature flagging systems. Must understand performance budgets, accessibility standards, and web security best practices."
Database Engineer,Mid,Amazon,Product,2-5 years,Bangalore,"Own database reliability, performance, and scalability for core platform services. Skills: PostgreSQL, Redis, Elasticsearch, and experience with database migration and schema evolution. Familiarity with connection pooling (PgBouncer), observability, and automated failover. Python or Go scripting for automation."
Data Analyst,Mid,HCL Technologies,Service,2-5 years,Bangalore,"Provide MIS reporting and analytics support for banking clients. Required: SQL Server, Excel (advanced), and Power BI. Experience with financial data, reconciliation reports, and automating recurring reports using Python. Good communication and documentation skills."
System Architect,Mid,Apple,Product,2-5 years,Bangalore,"Define and evolve the technical architecture for large-scale distributed platforms. Requires 8+ years of software engineering experience with deep expertise in microservices, event-driven architecture (Kafka), and cloud-native design (AWS/GCP). Must be able to lead architecture reviews, define engineering standards, and mentor senior engineers. Strong communication skills to align technical strategy with business goals."
System Architect,Senior,KPIT Technologies,Service,5-8 years,Bangalore,"Data Architect to design and govern enterprise data platforms. Required: Experience with data lakehouse architecture (Delta Lake, Apache Iceberg), data catalog tooling, and metadata management. Must define data modeling standards, manage data governance policies, and collaborate with data engineering and analytics teams."
AI Engineer,Mid,Goldman Sachs,Product,2-5 years,Bangalore,"Build AI-powered product features using LLMs, RAG pipelines, and vector databases. Strong Python skills, experience with LangChain or LlamaIndex, and OpenAI/Anthropic APIs. Must have hands-on experience with FAISS or Pinecone, prompt engineering, and evaluation frameworks for LLM outputs. Background in NLP strongly preferred."
System Architect,Mid,Accenture,Service,2-5 years,Chennai,"Enterprise Architect for large-scale ERP transformation. Required: TOGAF certification, experience with SAP or Oracle ERP architecture, and cloud migration strategy. Must create architecture roadmaps, manage technical risks, and present to C-level stakeholders. 10+ years of experience in enterprise IT architecture required."
Data Scientist,Mid,Slack,Product,2-5 years,Seattle,"Data Scientist to drive product and business decisions through data. Required: Python, SQL, scikit-learn, and experience with A/B testing and causal inference. Must be able to build and evaluate predictive models, create dashboards in Tableau or Looker, and communicate insights to non-technical stakeholders. Familiarity with BigQuery or Redshift required."
Cloud Engineer,Mid,Meta,Product,8+ years,New York,"AWS Specialist for a large-scale SaaS platform. Required: Deep AWS expertise (EC2, ECS/EKS, RDS, Aurora, DynamoDB, Lambda, S3, CloudFront, API Gateway), Terraform, and Python. Must design multi-region, fault-tolerant architectures, optimize cloud costs, and implement AWS security best practices. AWS Solutions Architect Professional certification required."
UI/UX Designer,Mid,Twitter/X,Product,2-5 years,Bangalore,"Design intuitive, delightful experiences for consumer products used by millions. Required: Figma, design systems expertise, and a strong portfolio demonstrating user-centered design. Experience with user research, usability testing, journey mapping, and prototyping. Ability to collaborate tightly with engineers and PMs and defend design decisions with data."
Backend Developer,Mid,Capgemini,Service,2-5 years,Bangalore,"Build integration middleware for ERP and CRM systems. Skills: Python or Java, REST and SOAP APIs, and message queues (ActiveMQ or RabbitMQ). Experience with data transformation, error handling, and working with legacy enterprise systems."
AI Engineer,Entry,Twitter/X,Product,0-2 years,Mumbai,"Junior AI Engineer to build AI-powered features using LLMs and APIs. Required: Python, experience with OpenAI or Anthropic APIs, and basic understanding of prompt engineering. Familiarity with LangChain or LlamaIndex is a plus. Must be able to build simple RAG pipelines, evaluate LLM outputs, and integrate AI features into web applications using FastAPI or Flask."
Machine Learning Engineer,Mid,Apple,Product,2-5 years,Bangalore,"Develop computer vision and NLP pipelines for core product features. Required: Python, Hugging Face Transformers, OpenCV, and experience fine-tuning LLMs. Familiar with GPU cluster management, CUDA optimization, and serving frameworks like Triton or TorchServe."
UI/UX Designer,Mid,Wipro,Service,2-5 years,Bangalore,"Design dashboards and enterprise portals for logistics and banking clients. Skills: Figma, wireframing, and responsive design. Experience working within existing design systems and delivering pixel-perfect mockups. Understanding of accessibility and usability principles expected."
Cloud Engineer,Mid,Nvidia,Product,0-2 years,Pune,"Azure Cloud Engineer for enterprise digital transformation. Required: Azure (AKS, Azure SQL, App Service, Azure Functions, Azure DevOps, Azure AD), Bicep or Terraform, and PowerShell. Experience with hybrid cloud connectivity (ExpressRoute, VPN Gateway) and Azure security (Defender for Cloud, Sentinel). Azure Solutions Architect Expert certification preferred."
System Architect,Senior,DeepMind,Product,5-8 years,Remote,"Solutions Architect to design scalable, cloud-native architectures. Required: 6+ years in software engineering, strong expertise in AWS or Azure, microservices design patterns, and API gateway architecture. Must create architecture diagrams, evaluate build vs buy decisions, and guide engineering teams through complex technical challenges. TOGAF or AWS Solutions Architect certification preferred."
AI Engineer,Mid,Anthropic,Product,2-5 years,Pune,"AI Engineer for multimodal AI applications (vision + language). Required: Python, PyTorch, experience with CLIP, LLaVA, or GPT-4V APIs. Must build image captioning, visual QA, or document understanding systems. Strong software engineering skills to productionize models as microservices."
Data Scientist,Mid,Infosys,Service,2-5 years,Bangalore,"Deliver data science solutions for healthcare and pharma clients. Skills: Python, SAS or SPSS, SQL, and Power BI. Experience with clinical data, survival analysis, and regulatory-compliant ML models. Knowledge of HL7 or FHIR standards is a bonus."
Machine Learning Engineer,Entry,HCL Technologies,Service,0-2 years,Hyderabad,"ML Engineer intern/junior role on the computer vision team. Required: Python, OpenCV, basic PyTorch, and understanding of CNNs and image processing. Projects or coursework in object detection, image classification, or segmentation are valued. Must be able to train models on GPU clusters and evaluate results systematically."
Embedded Engineer,Mid,Atlassian,Product,0-2 years,Hyderabad,"Embedded Systems Engineer. Required: C/C++, RTOS (FreeRTOS or Zephyr), and experience with microcontrollers (ARM Cortex-M, ESP32, STM32). Must design firmware for IoT devices, implement communication protocols (UART, SPI, I2C, MQTT), and optimize for low-power operation. Experience with hardware debugging (JTAG, oscilloscope) required."
Software Engineer,Mid,Nvidia,Product,2-5 years,Chennai,"Software Engineer focused on backend API development using Go. Required: 3+ years in backend engineering, strong Go skills, experience with gRPC, Protobuf, and PostgreSQL. Must be comfortable with high-throughput service design, observability (OpenTelemetry), and cloud-native deployments. Competitive programming background is a plus."
Database Engineer,Mid,LinkedIn,Product,2-5 years,Bangalore,"Build data infrastructure for real-time analytics and OLAP workloads. Required: ClickHouse, Snowflake, or BigQuery expertise, along with dbt and Airflow. Experience with columnar storage, partitioning, and optimizing analytical query performance."
Data Analyst,Mid,TCS,Service,8+ years,Pune,"Business Intelligence Analyst for FMCG client. Required: SQL Server, SSRS, Power BI, and Excel. Experience building financial dashboards, sales performance reports, and ad hoc queries. Must liaise with onshore business analysts and deliver reports on time. Knowledge of SAP Business Objects is preferred."
Data Scientist,Mid,Shopify,Product,2-5 years,New York,"Data Scientist for fraud and risk modeling. Required: Python, XGBoost, LightGBM, and experience with imbalanced classification problems. Must understand model explainability (SHAP, LIME), regulatory requirements, and real-time scoring pipelines. Experience with financial transaction data or insurance claims data preferred."
Frontend Developer,Entry,Spotify,Product,0-2 years,Hyderabad,"Junior Frontend Developer to build web UIs. Required: HTML5, CSS3, JavaScript (ES6+), and basic React or Vue.js. Understanding of responsive design, browser developer tools, and version control with Git. Exposure to REST API integration and component-based design. Willingness to learn TypeScript and modern frontend tooling."
Cloud Engineer,Mid,Capgemini,Service,2-5 years,Bangalore,"Deliver cloud infrastructure projects for manufacturing and retail clients. Skills: Azure (AKS, Azure SQL, App Service), ARM templates or Bicep, and monitoring with Azure Monitor. Experience writing technical proposals and client documentation."
Frontend Developer,Mid,Infosys,Service,2-5 years,Bangalore,"Develop and maintain web portals for banking and insurance clients. Skills: Angular or React, HTML5, CSS3, JavaScript, and REST API integration. Experience in responsive design, cross-browser compatibility, and working within client design guidelines. Basic knowledge of Java Spring Boot backend a plus."
Cloud Engineer,Mid,JP Morgan,Product,2-5 years,Bangalore,"Design serverless and containerized architectures for microservices. Skills: AWS Lambda, API Gateway, DynamoDB, and Docker/Kubernetes. Experience with event-driven architectures, infrastructure as code, and cloud security best practices."
Cloud Engineer,Mid,DoorDash,Product,0-2 years,Pune,"GCP Data and ML Platform Engineer. Required: Google Cloud Platform (BigQuery, Dataflow, Vertex AI, GKE, Cloud Run), Terraform, and Python. Experience building data and ML pipelines on GCP, managing IAM, and optimizing costs. GCP Professional Data Engineer or ML Engineer certification preferred."
Database Engineer,Senior,Adobe,Product,5-8 years,Pune,"Senior Database Engineer for large-scale distributed databases. Required: Deep expertise in PostgreSQL internals, sharding strategies, and high-availability setups. Experience with Cassandra or DynamoDB for NoSQL workloads and Elasticsearch for search. Must optimize for both OLTP and OLAP workloads and mentor the team on best practices."
QA Engineer,Mid,Mastech Digital,Service,5-8 years,Chennai,"Mobile QA Engineer. Required: Appium or XCUITest/Espresso, Python or Java, and experience testing iOS and Android applications. Must design end-to-end test suites, integrate with CI pipelines, and conduct exploratory testing. Experience with device farms (BrowserStack, AWS Device Farm) and crash reporting tools (Crashlytics)."
Software Engineer,Mid,Robinhood,Product,2-5 years,Chennai,"Software Engineer for fintech payment systems. Required: Java or Kotlin, Spring Boot, strong understanding of distributed transactions, idempotency, and financial data integrity. Experience with PCI DSS compliance, fraud detection hooks, and high-availability service design. Familiarity with Kafka for event-driven architecture."
Database Engineer,Entry,Apple,Product,0-2 years,Seattle,"Junior Database Developer. Required: SQL (MySQL or PostgreSQL), basic query optimization, and understanding of database normalization. Exposure to stored procedures, triggers, and indexing strategies. Willingness to learn database administration tasks and work with senior DBAs on performance tuning."
Database Engineer,Mid,Netflix,Product,2-5 years,Bangalore,"Design and optimize globally distributed database systems at massive scale. Required: Deep expertise in PostgreSQL or MySQL internals, query optimization, and indexing strategies. Experience with distributed databases (Cassandra, CockroachDB, Spanner), replication, and sharding. Strong understanding of ACID properties, CAP theorem, and storage engine internals."
Frontend Developer,Mid,Salesforce,Product,2-5 years,Seattle,"Frontend Engineer for consumer web products. Required: React, TypeScript, CSS-in-JS or Tailwind CSS, and experience with state management (Redux, Zustand, or Jotai). Must integrate REST and GraphQL APIs, write unit tests with Jest, and care deeply about performance and accessibility. Experience with Next.js and Storybook preferred."
Data Analyst,Entry,Slack,Product,0-2 years,Pune,"Junior Data Analyst to support reporting and analytics needs. Required: SQL (basic to intermediate), Excel (pivot tables, VLOOKUP), and familiarity with Tableau or Power BI. Ability to clean and transform datasets, create summary reports, and present findings to business stakeholders. Python basics (pandas) are a plus. Strong attention to detail and communication skills."
AI Researcher,Entry,Uber,Product,0-2 years,Seattle,"Research Intern / Junior Research Scientist in Generative AI. Required: Master's in CS/ML, solid PyTorch skills, and exposure to diffusion models, GANs, or LLMs through coursework or projects. Must execute research experiments independently, analyze results, and contribute to internal research reports. Strong mathematical foundations in optimization and probability."
AI Engineer,Mid,Wipro,Service,5-8 years,Chennai,"AI Automation Developer for RPA + AI project. Required: Python, UiPath or Automation Anywhere, OCR (ABBYY or Tesseract), and Azure OpenAI API. Experience building intelligent document processing workflows and integrating AI models into RPA bots. Must document processes, train business users, and support hypercare phase."
AI Engineer,Mid,Accenture,Service,2-5 years,Bangalore,"Build AI-powered document processing systems for banking clients. Required: Python, OCR tools (Tesseract, AWS Textract), and NLP skills. Experience with LLM-based information extraction and deploying solutions on Azure. Client communication and documentation skills essential."
Backend Developer,Mid,Shopify,Product,0-2 years,Chennai,"Node.js Backend Engineer for real-time applications. Required: Node.js, TypeScript, Express or Fastify, PostgreSQL, Redis, and Socket.IO. Experience with event-driven architecture, building APIs at scale, and managing async concurrency. Must implement comprehensive logging, error handling, and API versioning strategies."
UI/UX Designer,Mid,Airbnb,Product,2-5 years,Bangalore,"Own the design language and component library for a SaaS platform. Required: Figma, Storybook integration with React, and experience with atomic design principles. Ability to create both high-fidelity mockups and developer-ready specifications. Cross-functional collaboration skills essential."
System Architect,Mid,Capgemini,Service,8+ years,Hyderabad,"Solution Architect for digital banking platform. Required: Microservices architecture, API gateway (Apigee or AWS API Gateway), cloud (Azure/AWS), and knowledge of banking domain (core banking, payments). Must write solution design documents, lead technical workshops with clients, and oversee development teams."
Data Analyst,Mid,Persistent Systems,Service,5-8 years,Pune,"Product Analytics specialist. Required: SQL, Python, Amplitude or Mixpanel, and experience with product analytics frameworks (AARRR, HEART). Must design event tracking schemas, build retention and engagement analyses, and collaborate with product managers on metric definition. Experience with funnel optimization and cohort analysis."
Frontend Developer,Senior,Robinhood,Product,5-8 years,Chennai,"Senior React Native Developer for cross-platform mobile apps. Required: React Native, TypeScript, experience with native modules, Expo, and App Store/Play Store deployments. Must optimize app performance, implement push notifications, and deep-link routing. Familiarity with CI/CD for mobile (Fastlane, Bitrise) preferred."
Cloud Engineer,Mid,HCL Technologies,Service,5-8 years,Pune,"Azure Cloud Administrator for government project. Required: Azure (VMs, AKS, Azure SQL, Azure AD, Azure Monitor), PowerShell, and Terraform. Experience with Azure governance (Management Groups, Policies, Blueprints), hybrid connectivity, and BCDR. Must follow ITIL change management processes and produce compliance reports."
DevOps Engineer,Mid,Amazon,Product,2-5 years,Bangalore,"Manage and scale cloud infrastructure supporting millions of users. Required: Kubernetes, Terraform, AWS or GCP, and strong scripting skills (Python/Bash). Experience with service mesh (Istio), observability (Prometheus, Grafana, Datadog), and incident management. SRE mindset with focus on reliability, latency, and cost optimization."
Software Engineer,Mid,HCL Technologies,Service,0-2 years,Pune,"Software Engineer for manufacturing ERP implementation. Required: SAP ABAP or Java, REST integration, and SQL. Experience with SAP S/4HANA modules (SD, MM, FI) or Oracle ERP is preferred. Must write technical specifications, develop custom reports, and support go-live activities."
Software Engineer,Mid,Cognizant,Service,5-8 years,Bangalore,"Programmer Analyst for insurance domain. Required: Java, Microservices, REST APIs, PostgreSQL, and Kubernetes basics. Experience with ACORD standards or Guidewire platform is a bonus. Must participate in code reviews, unit testing, and support UAT. Flexible to work in shifts for US client support."
Database Engineer,Mid,SAP,Product,2-5 years,New York,"Data Warehouse Engineer. Required: Snowflake or BigQuery, dbt, SQL, and experience building and maintaining dimensional data models. Must design efficient ELT pipelines, manage data quality, and collaborate with analytics teams. Familiarity with Airflow for orchestration and experience with slowly changing dimensions."
Data Scientist,Senior,Netflix,Product,5-8 years,Bangalore,"Senior Data Scientist for NLP and search relevance. Required: Python, deep learning, Hugging Face Transformers, and experience with search ranking, query understanding, and semantic similarity. Must design offline and online evaluation frameworks and collaborate with ML engineers on deployment."
Data Scientist,Mid,LinkedIn,Product,2-5 years,Bangalore,"Analyze petabyte-scale behavioral data to surface growth opportunities. Required: SQL (BigQuery/Redshift), Python, and data visualization (Looker, Matplotlib). Experience with cohort analysis, funnel optimization, and user segmentation. Strong cross-functional communication skills."
Data Engineer,Mid,SAP,Product,5-8 years,Pune,"Data Engineer for analytics infrastructure. Required: Python, dbt, Airflow, SQL, and Snowflake or Redshift. Must design dimensional data models, build ELT pipelines, manage data catalog (Atlan or DataHub), and ensure data quality across the platform. Experience with data governance and stakeholder management."
Data Scientist,Mid,Atlassian,Product,2-5 years,Bangalore,"Drive product decisions through advanced analytics and experimentation. Requires expertise in Python (pandas, numpy, scikit-learn), SQL, and statistical modeling. Strong experience with A/B testing, causal inference, and Bayesian methods. Must be able to communicate complex findings clearly to PMs and executives. Experience with Spark and Tableau is a plus."
AI Engineer,Senior,IBM,Service,5-8 years,San Francisco,"Senior AI Engineer to lead development of enterprise AI products. Required: 5+ years in ML/AI engineering, deep expertise in LLM fine-tuning, RLHF, and production AI systems. Experience with multi-agent frameworks, tool-use, and building reliable AI pipelines at scale. Must mentor junior engineers and drive AI architecture decisions."
